data/tiempos_ejecucion.csv

ID,Tiempo_Minutos
Ablacion_SoloPPO,13.61955976486206
Hibrido_Base,14.628196863333384
Hibrido_LRAlto,10.741381684939066
Hibrido_EvapAlta,13.879176620642344
Hibrido_RedGrande,13.085238230228423
Hibrido_AlphaBajo,12.933765455087025
Hibrido_AlphaBajo_EvapAlta,14.54014268318812

README.md

### Salida Esperada

[TIEMPOS DE EJECUCIÓN (Minutos)]
- Solo PPO: 13.62 min
- Híbrido Base: 14.63 min
- LR Alto: 10.74 min
- Evaporación Alta: 13.88 min
- Red Grande: 13.09 min
- Alpha Bajo: 12.93 min
- Alpha Bajo + Evap Alta: 14.54 min
-----------------------------------
- Tiempo Total: 93.43 min